{
  "$schema": "https://raw.githubusercontent.com/dmccreary/claude-skills/main/src/book-metrics/book-metrics.schema.json",
  "metricsVersion": "1.0",
  "metricsGeneratedBy": "Book Metrics Python Program v0.08",
  "metricsGeneratedOn": "June 24, 2026 at 05:46 AM",
  "metricsGeneratedOnISO": "2026-06-24T05:46:15",
  "metrics": {
    "concepts": 200,
    "chapters": 17,
    "microsims": 94,
    "stories": 0,
    "glossaryTerms": 208,
    "faqs": 66,
    "quizQuestions": 140,
    "chapterQuizzes": 14,
    "chapterReferences": 0,
    "references": 0,
    "diagrams": 76,
    "equations": 130,
    "words": 178737,
    "links": 975,
    "appendices": 0,
    "mascotImages": 0,
    "developmentStage": "Not specified",
    "equivalentPages": 780
  }
}
